{
  "version": "1",
  "id": "can:zokrates:groth16:demo:valid",
  "framework": "zokrates",
  "proofSystem": "groth16",
  "urls": [
    "file:///home/tony/projects/zkpip/zkpip/fixtures/zokrates-groth16/valid/verification.json"
  ],
  "sha256": "99f914ef70e10ccd1986fa504530c23620396f06febfe744aef9ac01dfab5873",
  "size": 2444,
  "meta": {
    "sourcePath": "fixtures/zokrates-groth16/valid/verification.json"
  },
  "kid": "dev-1"
}
